{
  "$schema": "http://json-schema.org/draft-07/schema#",
  "title": "denidin-morning config schema",
  "description": "Canonical, runtime-loaded schema for apps/morning-mcp-app/config/config.json. FLAT shape: the three required credential keys are top-level (matching config.example.json / config.test.json and the existing sandbox integration tests, which read them flat). All runtime config comes from this file per CONSTITUTION §I (no environment variables). Mirrored for documentation at specs/in-definition/005-mcp-morning-green-receipt/artifacts/config.schema.json — keep both in sync; this copy is what config.py actually loads at runtime (self-contained for Docker, which does not copy the specs/ tree).",
  "type": "object",
  "properties": {
    "api_key_id": {
      "type": "string",
      "description": "Morning API key id (OAuth2 client_id), used in the /idp/v1/oauth/token client_credentials exchange (feature 053)."
    },
    "api_key_secret": {
      "type": "string",
      "description": "Morning API key secret (OAuth2 client_secret), used in the /idp/v1/oauth/token client_credentials exchange (feature 053)."
    },
    "api_url": {
      "type": "string",
      "format": "uri",
      "description": "Base URL for the Morning REST API. Sandbox: https://sandbox.d.greeninvoice.co.il/api/v1/ ; Production: https://api.greeninvoice.co.il/api/v1/"
    },
    "auth_url": {
      "type": "string",
      "format": "uri",
      "description": "Feature 053: base URL for Morning's OAuth2 token endpoint (POST {auth_url}/idp/v1/oauth/token) - a DIFFERENT host than api_url, confirmed against Morning's real, current OpenAPI spec (developers.morning.co). Sandbox: https://api.sandbox.morning.dev ; Production: https://api.morning.co . Required - never derived from api_url (CONSTITUTION §I: no inference)."
    },
    "file_upload_url": {
      "type": "string",
      "format": "uri",
      "description": "Optional: Morning file-upload gateway base URL (separate domain). Reserved for the future receipt-parsing feature (017); not used by the 8 invoice tools."
    },
    "environment": {
      "type": "string",
      "enum": ["dev", "prod", "test"],
      "description": "Which environment this container/process IS - read by watchdog.py against shared/active_env.json to detect a stale/mismatched container (2026-07-21 incident: a container for one environment stayed silently reachable while only the other was supposed to be active)."
    },
    "default_currency": { "type": "string", "default": "ILS" },
    "default_vat_rate": {
      "type": "number",
      "default": 0.18,
      "description": "VAT rate as a fraction (0.18 = 18%). Feature 098 uses it to derive a document's pre-VAT amount for the allocation check."
    },
    "allocation_threshold_nis": {
      "type": "number",
      "exclusiveMinimum": 0,
      "default": 5000,
      "description": "Feature 098: a tax invoice (305) or tax invoice/receipt (320) whose amount before VAT EXCEEDS this needs an allocation number (מספר הקצאה), so it is refused for a client with no 9-digit ID. denidin-app keeps its own copy of this value (its config's allocation_threshold_nis) - change both together."
    },
    "refresh_before_seconds": {
      "type": "integer",
      "default": 300,
      "description": "Refresh the token when it is within this many seconds of expiry."
    },
    "rate_limit_per_second": {
      "type": "number",
      "default": 3,
      "description": "Client-side rate limit to stay under Morning's ~3 req/s (429) ceiling."
    },
    "list_invoices_token_budget": {
      "type": "integer",
      "default": 2500,
      "description": "Feature 038: max estimated tiktoken (o200k_base) size of list_invoices' formatted reply before it's truncated to a best-effort prefix (with an honest 'showing X of Y' message) instead of returned in full. Default matches the observed practical MCP tool-call output limit; config-driven so it can be raised later (or lowered for a specific test) without a code change."
    },
    "openai_api_key": {
      "type": "string",
      "description": "OpenAI API key used only by tests/expensive/test_openai_invokes_mcp_e2e.py (Phase 5, T021) to drive this server as a remote MCP tool via the real OpenAI Responses API. Not read by the server itself. Never commit a real value - keep it in config/config.json only."
    },
    "mcp": {
      "type": "object",
      "description": "FastMCP server settings (streamable-HTTP transport).",
      "properties": {
        "server_name": { "type": "string", "default": "denidin-morning" },
        "host": {
          "type": "string",
          "default": "127.0.0.1",
          "description": "Bind address. The default (127.0.0.1, loopback-only) is correct and safest for plain local dev, but is NOT reachable through Docker's port mapping (-p) or an ngrok tunnel targeting the container - a process bound only to the container's own loopback cannot be reached from outside its network namespace (confirmed live: curl from the host got a connection failure until this was changed). Docker/container deployments MUST set this to '0.0.0.0' in the mounted config.json."
        },
        "port": { "type": "integer", "default": 8000 },
        "transport": {
          "type": "string",
          "enum": ["streamable-http", "stdio", "sse"],
          "default": "streamable-http"
        },
        "log_level": {
          "type": "string",
          "enum": ["DEBUG", "INFO", "WARN", "ERROR"],
          "default": "INFO"
        },
        "auth_token": {
          "type": "string",
          "description": "Optional shared bearer-token secret. If set, the MCP server rejects any request without a matching 'Authorization: Bearer <token>' header (401) - see server.py's BearerTokenMiddleware. If unset (default), no auth is enforced - appropriate for pure local/dev use (this server has one expected main consumer, denidin-app, plus ad hoc manual tests; set this once the server is exposed via a tunnel/public URL). Never commit a real value - keep it in config/config.json only."
        },
        "ngrok_authtoken": {
          "type": "string",
          "description": "Optional ngrok account authtoken. If set (along with ngrok_domain), run_morning_mcp.sh starts a persistent ngrok tunnel exposing this server publicly (used by tests/expensive - the OpenAI remote-MCP E2E test - which needs a URL OpenAI can reach). If unset, no tunnel is started; the server just runs locally as before. Never commit a real value."
        },
        "ngrok_domain": {
          "type": "string",
          "description": "Optional ngrok reserved/static domain (requires a paid ngrok plan) to give the tunnel a stable hostname across restarts, e.g. 'your-app.ngrok-free.app' or a custom reserved domain. Only used if ngrok_authtoken is also set."
        },
        "status_file": {
          "type": "string",
          "description": "Feature 018 (DeniDin integration): optional path to a JSON status file this app publishes when its tunnel comes up (`{\"server_url\": \"<https>/mcp\", \"updated_at\": \"<UTC ISO>\"}`), and clears on shutdown. run_morning_mcp.sh/docker-entrypoint.sh write it; denidin-app's MorningMcpLocator reads it to discover the current (rotating, free-tier) tunnel URL without either app importing the other's code. If unset, no status file is written (no-op, unaffected behavior)."
        }
      }
    },
    "feature_flags": {
      "type": "object",
      "description": "Feature gates per CONSTITUTION §I/§VI (default false).",
      "properties": {
        "enable_mcp_server": {
          "type": "boolean",
          "default": false,
          "description": "Gate for starting the FastMCP server. When false, the server entrypoint does not start; the existing client library and its integration tests are unaffected."
        }
      }
    }
  },
  "required": ["api_key_id", "api_key_secret", "api_url", "auth_url"]
}
